{
  "generated_at": "2026-07-22T13:24:43",
  "count": 13,
  "active_status_workflow": "personal",
  "workflow_count": 2,
  "workflows": [
    {
      "name": "personal",
      "active": true,
      "status_values": [
        "unread",
        "skimmed",
        "reading",
        "read",
        "archived"
      ],
      "reading_stage_values": [
        "skim",
        "normal_read",
        "deep_read",
        "code_checked"
      ],
      "review_stage_values": [
        "fresh",
        "due",
        "reviewed"
      ],
      "fields": {
        "status": {
          "field": "status",
          "label": "阅读状态",
          "configured_count": 5,
          "used_configured_count": 1,
          "defined_count": 5,
          "deprecated_count": 0,
          "empty_count": 0,
          "empty_slugs": [],
          "values": [
            {
              "value": "unread",
              "count": 0,
              "configured": true,
              "definition": {
                "description": "Known paper that has not been opened or routed into a reading pass yet.",
                "owner": "workflow",
                "status": "active"
              },
              "definition_status": "active",
              "description": "Known paper that has not been opened or routed into a reading pass yet.",
              "owner_name": "workflow",
              "href": "library.html?workflow=personal&status=unread"
            },
            {
              "value": "skimmed",
              "count": 0,
              "configured": true,
              "definition": {
                "description": "Paper has received a quick pass; keep it visible for deeper reading or triage.",
                "owner": "workflow",
                "status": "active"
              },
              "definition_status": "active",
              "description": "Paper has received a quick pass; keep it visible for deeper reading or triage.",
              "owner_name": "workflow",
              "href": "library.html?workflow=personal&status=skimmed"
            },
            {
              "value": "reading",
              "count": 0,
              "configured": true,
              "definition": {
                "description": "Currently being read, annotated, reproduced, or used for an active synthesis task.",
                "owner": "workflow",
                "status": "active"
              },
              "definition_status": "active",
              "description": "Currently being read, annotated, reproduced, or used for an active synthesis task.",
              "owner_name": "workflow",
              "href": "library.html?workflow=personal&status=reading"
            },
            {
              "value": "read",
              "count": 13,
              "configured": true,
              "definition": {
                "description": "Main report is stable enough to use as reference material.",
                "owner": "workflow",
                "status": "active"
              },
              "definition_status": "active",
              "description": "Main report is stable enough to use as reference material.",
              "owner_name": "workflow",
              "href": "library.html?workflow=personal&status=read"
            },
            {
              "value": "archived",
              "count": 0,
              "configured": true,
              "definition": {
                "description": "Kept for provenance but no longer active in current queues or weekly review.",
                "owner": "workflow",
                "status": "active"
              },
              "definition_status": "active",
              "description": "Kept for provenance but no longer active in current queues or weekly review.",
              "owner_name": "workflow",
              "href": "library.html?workflow=personal&status=archived"
            }
          ],
          "unconfigured": []
        },
        "reading_stage": {
          "field": "reading_stage",
          "label": "阅读阶段",
          "configured_count": 4,
          "used_configured_count": 2,
          "defined_count": 4,
          "deprecated_count": 0,
          "empty_count": 0,
          "empty_slugs": [],
          "values": [
            {
              "value": "skim",
              "count": 0,
              "configured": true,
              "definition": {
                "description": "Fast pass for scope, claims, and whether the paper belongs in this library.",
                "owner": "workflow",
                "status": "active"
              },
              "definition_status": "active",
              "description": "Fast pass for scope, claims, and whether the paper belongs in this library.",
              "owner_name": "workflow",
              "href": "library.html?workflow=personal&stage=skim"
            },
            {
              "value": "normal_read",
              "count": 0,
              "configured": true,
              "definition": {
                "description": "Standard reading pass focused on method, experiments, and limitations.",
                "owner": "workflow",
                "status": "active"
              },
              "definition_status": "active",
              "description": "Standard reading pass focused on method, experiments, and limitations.",
              "owner_name": "workflow",
              "href": "library.html?workflow=personal&stage=normal_read"
            },
            {
              "value": "deep_read",
              "count": 11,
              "configured": true,
              "definition": {
                "description": "Detailed pass including equations, assumptions, ablations, and cross-paper comparison.",
                "owner": "workflow",
                "status": "active"
              },
              "definition_status": "active",
              "description": "Detailed pass including equations, assumptions, ablations, and cross-paper comparison.",
              "owner_name": "workflow",
              "href": "library.html?workflow=personal&stage=deep_read"
            },
            {
              "value": "code_checked",
              "count": 2,
              "configured": true,
              "definition": {
                "description": "Implementation, repository structure, or reproducibility notes have been checked.",
                "owner": "workflow",
                "status": "active"
              },
              "definition_status": "active",
              "description": "Implementation, repository structure, or reproducibility notes have been checked.",
              "owner_name": "workflow",
              "href": "library.html?workflow=personal&stage=code_checked"
            }
          ],
          "unconfigured": []
        },
        "review_stage": {
          "field": "review_stage",
          "label": "复习阶段",
          "configured_count": 3,
          "used_configured_count": 0,
          "defined_count": 3,
          "deprecated_count": 0,
          "empty_count": 13,
          "empty_slugs": [
            "2307.08691-flashattention-2",
            "2501.01005-flashinfer",
            "2503.01840-eagle-3-scaling-up",
            "2503.14075-twigvlm-plus-plus",
            "2507.11851-llm-future-mtp",
            "2512.23424-akg-kernel-agent-multi",
            "2602.06036-dflash",
            "2603.03251-speculative-speculative-decoding",
            "2604.11035-introspective-dlm",
            "2605.12825-orthrus",
            "2607.00466-eldr",
            "noarxiv-2026-dspark",
            "semantic-search-evaluation"
          ],
          "values": [
            {
              "value": "fresh",
              "count": 0,
              "configured": true,
              "definition": {
                "description": "Recently reviewed; no immediate spaced-review action is needed.",
                "owner": "workflow",
                "status": "active"
              },
              "definition_status": "active",
              "description": "Recently reviewed; no immediate spaced-review action is needed.",
              "owner_name": "workflow",
              "href": "library.html?workflow=personal&reviewStage=fresh"
            },
            {
              "value": "due",
              "count": 0,
              "configured": true,
              "definition": {
                "description": "Ready for scheduled review, synthesis, or update against newer related work.",
                "owner": "workflow",
                "status": "active"
              },
              "definition_status": "active",
              "description": "Ready for scheduled review, synthesis, or update against newer related work.",
              "owner_name": "workflow",
              "href": "library.html?workflow=personal&reviewStage=due"
            },
            {
              "value": "reviewed",
              "count": 0,
              "configured": true,
              "definition": {
                "description": "Completed the planned review checkpoint.",
                "owner": "workflow",
                "status": "active"
              },
              "definition_status": "active",
              "description": "Completed the planned review checkpoint.",
              "owner_name": "workflow",
              "href": "library.html?workflow=personal&reviewStage=reviewed"
            }
          ],
          "unconfigured": []
        }
      },
      "unconfigured_total": 0,
      "empty_total": 13,
      "definition_total": 12,
      "deprecated_total": 0,
      "board_href": "board.html?workflow=personal",
      "library_href": "library.html?workflow=personal"
    },
    {
      "name": "research",
      "active": false,
      "status_values": [
        "inbox",
        "triaged",
        "reading",
        "implemented",
        "cited",
        "archived"
      ],
      "reading_stage_values": [
        "skim",
        "normal_read",
        "deep_read",